嗜睡症,广电总局也真是幽默，每天那么费劲的在审查，却没有禁播这片。看完后满满都是在中国生活的无奈与悲凉。虽然的确有很多不适，可我倒觉得这比好多同类型片不做作的多,力荐
Jasmine_W,只有歌还行。。。真的屎一样。。。,很差
一里一予,剧情很好。但是我一想到它是话剧改的就有点方,推荐
林小童,20161031上地嘉华夜场，真好，简单质朴荒诞真实，跟昨晚看的话剧一样好。北方的冬季的晴朗的夜里，所有美好不美好都是美好的。你帮助别人心疼别人处处周到温柔对所有人好，你能看见对方的变化，你帮别人排忧解难，可是谁解你心里之苦。,推荐
扬.伯特,用力过度。。小品既视感，但是鉴于最近国产电影的风气，还是给予5星评价，起码好好地拍了部电影。,力荐
Roy_aqua,女权 借古讽今 一唱三叹 真的是非常精彩的剧本 虽然表演过于话剧了 但是敢讽刺wg 有种！,力荐
西红柿,一般吧，凑合,还行
ninininini,还不错的,推荐
麻 糖,为一曼,力荐
草木的生活,看很多评论都说这部电影前面要笑后面得哭。我也忍住不看剧透，结果前面很好笑后面却没哭。吃公饷在如今看来是多么普通的一件事，却被编出这么一个有很多隐喻的故事，让人大赞。一曼是个好听的名字，原来真正的演员真不需要很漂亮。从电影院出来等车感觉下起了雪，伸出手就落入了掌心。,力荐
helen,剧本很强大，就是越看越不舒服,推荐
零晨三点不打烊,真的很棒,力荐
柒*',谁又不是所谓的驴得水呢？,力荐
rachel,确实很有深度,力荐
二狗非狗,不可思议的中国,推荐
Enigma,今天电影院里有一个小朋友大声说：“她为什么要自己打自己啊，她是不是疯了？她是不是疯了？”之后听到了她家长的嘘~。 然后十分钟之后她就真的疯了。#小孩子害怕疼痛，大人们已经习惯疼痛。#前半场满场笑声，后半场全场沉默无言。,推荐
低俗小説,中国版荒蛮故事！这样的电影能上映也算是一种进步，（也许是最后的延安梗才能上映的哈哈，）剧本厉害了。（比起编剧的一个好故事，别纠结电影语言，如果真想看纯粹的电影，推荐王家卫）,力荐
小听,Sir讲得对。开始，你以为这是一个乡村教育的轻喜剧，然后它讽刺了贪污和教育；接着你发现，它还不仅在说贪污和教育，它向近代中国的国民性开刀；最后，你恍然大悟，它的击打范围，不局限于中国………,力荐
谦谦如梦,不仅搞笑，且有深度，虽然有舞台剧的范，但是也掩盖不了出色的光芒。这淫秽和隐晦，厉害！,力荐
lpunk,不能说它不像电影所以不是好电影，是好电影。,力荐
鹿苑,裴这种人真是可怕...以及旁边那对麻烦回家搞ok？,推荐
stigernobye,一点都不喜剧 看的人很难受,力荐
疯人韩,往往一个谎说出去需要千千万万个谎去圆，其实是个荒诞的悲剧，这赤裸裸的人性,推荐
精神癫狂小分裂,特~别~好~  想去开心麻花应聘，继续你们的电影之路吧。#看的时候想起了<杀生>#,推荐
远笛.,后面也太突兀了。,还行
勺子是婉不是碗,看封面看介绍都是喜剧，然而全都不按套路出牌，所以什么时候再来一部,力荐
willer,161031，记住了任素汐。看完心碎。,力荐
Caroline,唉,力荐
百器徒然,国产电影里最好的话剧，国产话剧里最好的电影。,还行
逆光,来，我给你讲个深刻的故事,较差
YeeR,？,较差
永远大魔王,看铁男想到段小楼,力荐
﹏小某,身边全是这种人，身边都是这种人，不可思议的中国,力荐
冬天挖竹笋,我不知道到底是我get不到笑点，还是我品味高额（这样说会不会有点浮夸(⊙﹏⊙)），个人觉得非常不好看，现代社会的拌嘴式耍宝，低俗式污的搞笑，刻意十分做作的揭露现实黑暗（其实蛮正常，还不如新闻），个人觉得真心很烂很烂很烂很烂很烂啊啊啊,很差
Jade,“过去的如果就让它这么过去，以后只会越来越糟。”男性角色贪念和懦弱交织的面貌粗鄙陋人，女性角色真实可爱多了。,推荐
狗2,虽然特别话剧的感觉，但仍然不失为好本子。有笑有泪。做大事要不拘小节，最后是不拘小节了还是没了底线。,力荐
曲终人也散,年度最佳,力荐
云雀高飞,黑色幽默+荒诞喜剧，看起来那么过，感觉又那么真实，利益之下，人性是那么软弱。张一曼演得真好，歌也好听！,力荐
Yoli,拍的特别好,力荐
茄子酱,葬礼的哀乐用的是《三民主义歌》，中华民国的国歌。另外，美国国旗用错了，民国31年时的美国国旗没有50颗星星。,力荐
阳果子,什么他妈的原则 在大局面前都特么是个屁 呵呵呵呵呵呵,推荐
亲亲宝贝,黑色幽默，借古讽今。,推荐
kikyo,哔了狗了,还行
浪 子 不 二,一点正能量都没有的东西 不敢说好 但肯定不差！就是一个舞台剧 还是有点不像电影 场景就在一个地方 所有故事发生 台词功力太强！另外P.S有人说太话剧了那是你们知道这个是麻花团队的作品如果你不知道这个是麻花做的没准儿你们还会说第二部《十二公民》呢真牛逼so别乱喷 你行你up不行别bb咋那么膈应人那,推荐
凉冰清,以为是喜剧，却不想看哭了,力荐
chrisliver,不错，很深刻，更惊奇的是演员演技都超级棒！！比那些流量小生不知高出多少等级。。缺点是话剧味道太浓了,力荐
北燕南非,说完美那是假的，但有了其他国产片的映衬，五星是必须的了,力荐
阿桃_Crystal,还是有话剧痕迹。前半部分笑得越开心，后半部分越是笑不出来，即使硬塞笑点也没办法。看完后很压抑的一部电影，赤裸裸地将人性的丑恶搬上大银幕，而且用力过猛导致有些观影不适....任素汐的歌声很好听，但那首憧憬了美好生活的歌听起来却很悲伤....最大的疑问是..怎么过审的呢→_→,还行
湖心婷看雪,演的很刻意，个个都是生动的话剧演员，然而出现在荧幕上感觉很尴尬,还行
Amare.K,这世界上没有好人。,推荐
三七二十一,整部电影基本没有一个能叫人喜欢的角色，但特别讨厌的倒是有好几个：周铁男、孙佳、铜匠，之所以不讨厌老裴是因为这个角色的前后连贯性，他的言行符合他的人设，所以能接受，铜匠老婆同理。而周铁男是人设前后太崩了，太恶心人，孙佳是正面的用力过猛以至于像个傻逼，铜匠和周铁男差不多恶心。,推荐
陳長安,美梦成真,推荐
丁廿一,没觉得值那么高的分数，舞台剧改编电影，不能太舞台剧啊,较差
衣锦褧衣小肉猪,难得有个戏，看完之后无法喜欢里面的主角。，角色太多都不讨喜了。,力荐
十纥,整体太戏剧化了，也表现的太直白，还有这不就是去电影院看了场话剧吗,还行
VIVIANZHOU_,前一小时尴尬的不行，后一个小时信息量开始爆炸。导演想拍的很有深度，但表现方式和台词语言还需要再斟酌。在喜剧这个类别上是不如夏洛特烦恼的。,推荐
M.,67.  穷山恶水出刁民啊  铜匠这报复心  简直了。。。,力荐
咕咕花生小姐,良心电影,力荐
specil,广电能过就挺厉害的。。哈哈哈,力荐
随遇而安,叙事流畅，人物逻辑和观赏性方面并不好，就是一大号小品或者大号舞台剧。,较差
私物语君,这个评分我也是看不懂了，只要不是商业片，评分就高的离奇，一群人用力过猛，这不是电影。,很差
dcrlee,笑过之后的心塞，笑过之后的无奈，笑过之后的无所适从，喜剧的最高境界其实是悲剧。为了审查制度的妥协，其实也是不得已而为之，骨子里面的讽刺和影射，才是本片真正鲜活之所在。当老一辈艺术家们渐渐偃旗息鼓，我们还有开心麻花，还有期待。本片不适合带老人孩子去看，成年人可以看出更多的解读。,力荐
小驸马,整体不错。还是可以看看的。,还行
AROBTTH,这个剧本足矣。电影本身依然话剧化，也好也不好，但海报预告宣传何时可以跟上？！,力荐
生活杂种,有意思,推荐
陈土豆,前半场笑，后半场哭,力荐
月半人,整个电影前后割裂感极其严重，这不是讽刺也不是喜剧，甚至都不算电影,很差
wadekobex,不错，内容很精彩,力荐
王贝贝,不舒服不舒服不舒服,推荐
呆呆,不愧是话剧演员，演得都蛮到位的~但是总感觉有点太用力了~,力荐
正版文峰,支持国产！更何况真的不错。,力荐
Biskup,喜剧的里子都是悲剧,力荐
兔子恶魔,用喜剧的手法拍摄悲剧，用黑色幽默诠释人性，国产片能拍到这水准真不容易，力荐！,力荐
国士无双,好剧本好表演，但是对话剧的电影化比夏洛特烦恼还差，有好有坏吧至少在银幕上看到这样的作品还是让人欣喜,力荐
siyao41,挺讽刺的，一曼最后太惨了。以为是喜剧，最后却哭了。,推荐
YIKI,少给一颗星吧.话剧搬上荧屏少了一座桥梁.剧本完美.把你从嬉笑带入深思.,推荐
candy,高潮叠起。我记得高中讲话剧时说到的几要素，最重要的是要有冲突。这部里几个教师之间的冲突，教师和特派员的冲突，铁匠和所有人的冲突，完美的构成一个剧。虽然是电影但却做得非常棒！,力荐
福福,本以为是荒诞喜剧，结果让人挺伤感的。,力荐
水中月,笑着笑着就哭了～,推荐
多多,看完瞬间觉得现实比以前完全没有进步多少，甚至退步了！高，实在是高！,力荐
cwyalpha,三观不正 逻辑不通 部分情节有点像把东北二人转的恶俗搬上荧幕,较差
流氓无产者,荒诞式的残酷，影片色调的鲜艳给这种荒诞增添了一幕诡异的色彩，一个没有学生的农村学校上演着八恶人的故事。,力荐
vanilla,并不喜欢这部，脑洞太大绕啊绕啊瞎扯淡…评分高是因为很多地方讽刺了社会现实？可是怎么看怎么作。整体来说喜剧不像喜剧，深刻也不够深刻…,还行
CrabfishT,我觉得能过审这件事说明总局也并非完全食古不化啊。,力荐
破亭子,看完让人心情沉得化不开又无法用语言形容的而黑色喜剧~,推荐
Mr. White,剧中最让人怜的三个女人竟没有直接的对手戏；想谈教育？男权？党国？命运？呵呵，跟夏洛特烦恼一样三观不正,推荐
名字叫什么呀,前面的部分，有污有笑点，后面那部分，情绪好沉闷，总是想哭又哭不出来！话说女主在剥大蒜，唱我要你这首歌的时候，真的好美,力荐
凯撒苏斯,小曲儿唱的真好,推荐
Solitude,3.7。剧本5星。但从表演形式、演员走位、情节转折和角色极强符号性来看，完全是话剧式的电影。虽然艺术形式取消距离是趋势，但两个形式跨越的不圆融还是作品硬伤。另外，讽喻野心太大，想面面俱到，反而是一种过度。,推荐
寂朱,很好看！推荐大家去看,力荐
朱颜,看的心累 女性自由多么重要！！,推荐
雨呓甘蓝,喜剧的外衣  悲剧的内核  诚如和菜头所说  是把知识分子黑得最彻底的一次  电影越荒诞  现实就越刺痛,推荐
我不是文青,剧本牛逼，故事讲得好，就是不太像电影。,推荐
饕客琛,前半段一直在开车，引得影院里的老司机们阵阵憨笑，后半段却再也没有听到过笑声，仿佛这并不是一部喜剧。,力荐
指甲不开花,讽刺喜剧泪目两次 任素汐把纯洁的放荡女人演太好了 好感度完全高于《祖与占》里头的女主 虽然有这样那样的诟病 但故事说到位 对国产电影来说已经很不错了 想看话剧版~,力荐
ilrpp,2颗给樊冲2颗给任素汐,推荐
王小笨,虚火。那些意义影射揭露讽刺我都知道，也都懂，也知道很重要，但这一切都要建立在合理的方式上，这部电影从特派员第二次来到学校，就开始进入失控和混乱，之后所有的转折所有的改变，都刻意且让人觉得不适，也基本没考虑合理性。而且它其实就是一部话剧嘛，电影感很弱，看所有人扯着脖子说话就知道了。,较差
明亮,前后人物转折太大了，看的很不舒服,还行
二重身,音乐很好，电影不错，心情很糟。教育和知识的多寡看似没有什么作用，在内心的恐惧面前。,推荐
豆嫩哥,周铁男一定和秘书有py交易,力荐
东宝株式会社,水军严重已经到丧心病狂的程度了，全程各种尴尬。,很差
J,尽管故事不错，但完全把舞台剧照搬上电影屏幕合适吗,很差
Miss Invisible,开心麻花，下一部拍啥！,力荐
叔策,即使有些地方太有话剧感，即使人物转变太过直接，这还是一部好电影。一部彻头彻尾的悲剧，就算电影里最单纯正直的理想主义者最后的交待也是去往1942年的延安，以她的性格结局可想而知。就算观影前半段笑的再大声，到谢幕时也会沉默，这是对它最好的评价。,力荐
care 92,每个角色真是张力十足，每个演员演技也是各有千秋。超爱女主的戏，看样子是要火的节奏。今年大陆戏中无疑是它领跑了。,力荐
磊、尕 cry,我心目中的国产年度最佳。满分好评。影院已阅。用小喜剧演的一场大悲剧 猛烈讽刺 人性。看完出影厅心情已绝望到极点。,力荐
狄大人,最想得清的，是不懂大局，一直被念叨是孩子的佳佳。怪不得剧本如此厉害，原来出身话剧。每个人都是缩影。,力荐
大尾巴,女主很像张爱玲的感觉，高高瘦瘦的穿着旗袍,力荐
小姐牌,看的人太沉重了，愿我们不要走到这步,力荐
为什么放弃治疗,喜剧总动员重新定义了喜剧，开心麻花重新定义了开心。不仅不开心还给我气到不行！,较差
爱！回家,难得的批判电影,力荐
犹太人依然,“驴得水作为话剧改编的电影，萌新导演导致电影本身节奏不够连贯以及电影本身电影感的缺失。但是优秀的本子与话剧演员们出色的演技让这部电影在最近垃圾扎堆的市场上给了大家一个很棒的选择。如果不介意看一部糟心的片子的话，那请接下我这发安利。”值得一看！最后一曼留下的四套衣服，很戳泪点😭,推荐
卫龙,剧本真好，看得好难过,力荐
LAN,黑色幽默荒诞喜剧。故事很好，可惜舞台剧痕迹太深，缺少些电影的魅力。一曼很美，《我要你》很好听。“过去的如果就让它过去了，未来只会越来越糟。”,推荐
530,欲望之下都杀红了眼。,力荐
信子,剧本真的好！看完有种想说点什么但是却如鲠在喉的无力感，特别现实！指不定过两年我每月工资真的要扣丧葬费了(摊手呵呵哒),力荐
Saint Angel,故事和演员很棒～但是作为电影完成度太差，话剧转电影还是不太合格……一曼这个角色很触动，天真烂漫却少了一分坚强，最后唯一悲惨的结局。即使这样也是超其他所谓的电影不止一点点～,推荐
活在当下,不知道评分的标准，但本人不喜欢这种话剧化的电影，过于夸张。,较差
Baunir,哎 长叹一口气,推荐
古旭荣,挺好的，后面有点泄气。就是还有点话剧。,推荐
电影审判员,好片！！,力荐
听琴思棋,作为喜剧很成功，演技爆表，借古讽今,推荐
开场白、,开心麻花第二部作品，暂时是部部佳作，期待下一部！剧本很好，让我接触到新事物，然后还可以写的这么荒诞直接粗暴！电影院里看的，确实污，那么多人一起看，有点…这女主让人眼前一亮，除了颜值略低外，剩下都很好，尤其那首歌！差1星，主要是最后那段，全是大吼，用力过猛，看着难受！,推荐
北辰宇洛,开心一直很擅长将一个很庄重严肃的题材用喜剧的方式表现出来，并且表现得很好。舞台剧改变的剧本，单一场景讲完整个故事很考验导演和演员的功力，所幸他们做得很棒。,力荐
三米,内容太复杂了。各种讽刺。给个4星不过分。,推荐
cretin,每个人物的性格刻画都很到位 什么性格会做什么事 形势比人强 不得不低头 刚开始走错了一步 撒了谎 后面的事就不是自己能控制得住的了 形势是个大染缸 不知道自己进去是黑的出来 还是红的出来   现实蛮荒诞的  希望初心不改 能得始终  不要再走着走着就偏了  (๑⁼̴̀д⁼̴́๑),力荐
余困困,一直在期待反转结果剧情就这么平铺直叙，一直以为会深挖人物历史结果只停在嘴上说说。整部电影太话剧，尤其是场景切换，每次都是4，5秒的静景。黑色不够，喜剧也不足。真的就很一般。,还行
xinjing,前面很搞笑 后面很讽刺,推荐
风吹麦浪,电影感弱了些，这种喜剧方式还不错,还行
橙子哩哩,开心麻花的良心与野心。,力荐
斤半不足钱,人性吧，不要过分苛责，当你面临那种处境，未必表现更好,力荐
摩小羯同学,算新颖，但并不觉得很好看，有点尴尬～,还行
Bee枷锁,借古讽今，看的那场只有六个人，看完挺沉重的，值得一看。,力荐
拂尘,喜剧是悲剧的最高表现形式，开心麻花真棒！最后的马车一个趔趄把满箱子的彩球从山坡上滚下，真是五彩斑斓的凄凉,推荐
好牧人,孙佳那演员到底多大，老太太一样的表演方式,推荐
发条橙,最后孙佳不去延安找哥哥的话估计这个本子过不到审吧！,还行
❀.婳,去之前就知道是悲剧，看完还是落了满心压抑,推荐
捍卫民国,揭露小屁孩不懂的人性然后黑民国最后还要自干一下，真是专业骗分。,很差
杜会堂,结尾没处理好，更喜欢在癫狂中毁灭。,推荐
DBSN,很棒,推荐
一川,中国内地少见的黑色幽默讽刺剧，演员有些用力过猛不过总体来说表现得不错。,推荐
老冯,好故事无需华丽的包装，灯光，特效，什么都没有，就是个好故事，一样高分，麻花加油！,力荐
肥嘟嘟左卫门佐,这是一曼被黑的最惨的一次。,推荐
渌水幽兰,故事虽然很好，但是电影感太弱,还行
加可,年度最爱角色出现了,推荐
圣殿骑士,去你玛德傻逼,很差
反正,年度最佳纪录片。,推荐
崔小满,本来想看喜剧放松心情 没想到看完心里那么憋屈 but 我喜欢 演员表演张力好大 不愧是话剧出身,力荐
豆腐花队长,三星半～越看越悲伤～“驴得水对不起，我把人教坏了”,还行
悦大,我不喜欢用电影手法去评判它的好坏。本子够硬，撑的住整台戏，它像一首民谣，不炫技，好电影都是从讲一个好故事开始的。,力荐
Scorpio.,可悲，每个人都可悲。猜到一曼会自杀但听到最后一声枪响，还是没憋住眼泪。,力荐
嬉皮的木呐公子,一曼就是自由主义者。东北小伙上半段那么横一人，后面就开始趋炎附势了。好看。,力荐
只爱三脚猫,黄光裕出狱出来拍电影了？,力荐
田家明,评分还挺高，但是欣赏不来，用力过度，过火，刻意！后半段的台词太直白，表演也过猛。就不能含蓄点，内敛点？有时候太直白刻意别人不是不能接受，不能欣赏，只是会显得你的剧本和编排没有层次，刻意而为，为了讽刺而讽刺。,还行
煎釀三嬸,Incredible China . 每个角色都有令人憎恶的一面，混杂在一起有一股浓郁的催吐味道。一味地反讽，却没有任何直面的教育,还行
闷骚马小猴,精巧的剧本，舞台剧的影视化创作，取探人性的荒芜。（2016.10.30 西安胡家庙CGV，少年）,力荐
猫猫的毛线,张一曼完全是个败笔，如果写成最终是她和铜匠假结婚，然后因为被迫和所爱结婚而自杀，岂不美哉,还行
JCW,能公映，加一星。,推荐
死神的挽歌,舞台元素太多，用电影表现出来，从拍摄到配乐都太业余，显得劣质。剧情完全是一出闹剧，讽刺能感受到，感动一丝没有。不推荐,较差
王祖甜,惊艳十足,力荐
海通证券一泡污,内容本身足够深刻四星，讽今+1星，最后那句马屁-1星，结果四星。如果最后加一句‘‘两年后，孙佳自杀’’，那就完美了。可惜那样你就放映不出来了。,推荐
小伟,一步错，下步如何不错？,力荐
树织,最大的悲剧，女主是唯一的真君子。,推荐
以前猛现在不猛,算是中国电影的一个跨步,力荐
Vivian,是个好剧本，但我并不喜欢这种赤裸裸揭露人性之恶的东西。在那些丑恶的嘴脸面前，我宁可掩耳盗铃。一曼被剪头发那段，脑子里都是狗镇所描绘的的张牙舞爪。「过去的如果就让它过去了，未来只会更糟」,还行
B-B-B-Side,111分钟的故事，分分钟精彩。无论是剧情的转折还是人物性格都“异常”饱满，贪婪的人性，腐败的教育体制通通黑得体无完肤，剧本很有意思，虽然演员的演绎到有些话剧成分但我就喜欢这口，这黑色幽默喜剧算得上今年最佳国产喜剧片，电影8分，推荐！,推荐
Tough-Worker,不是happy ending的结局值得鼓励吧～,还行
久申格桑,一场一切都来得那么自然的批判。中国造，太难得！,力荐
最后的第二空间,故事是个好故事，主题也可以拿来玩味一番，但这真的不是一部好电影！我们只是在电影院里看了一场舞台剧。它比开心麻花的上一部作品《夏洛特烦恼》还要舞台化，是因为观众对《夏洛特烦恼》的纵然使他们更加放纵、懒惰了吗？全片可以让我觉得是在看一部电影的，只有神像出现的那三个瞬间。,还行
X西蒙妮,女权味儿很重，一路看下来的感觉就是男人没一个好东西,推荐
造雨人,时代的符号植入得太差了，服化道的不严格只能落下审丑的下场。表演功底倒是不错，比《夏洛特烦恼》好多了，不过又是一部悲伤的喜剧，最后的枪响直射刚才没心没肺大笑的我们。,推荐
凡林,在大局面前我们是蝼蚁，个人意志不够坚硬脆弱就显得没有区别，任意而为只是还没碰到死穴。,推荐
你好，忧愁！,遗憾没有看话剧，剧本5星，即便在影院还是能感受到强烈的话剧风格,力荐
苏四,支持国产的4星。,推荐
菊门大开,想看一部喜剧开怀大笑却如鲠在喉,推荐
Dr_T,1、演技爆表，一曼的角色太印象深刻！2、细节保留了话剧等级。3、剧情极其深刻。4、影院观影非常有必要。5、过后仔细想想，这电影给人一个感觉，就是看的好像不是个电影，而就是一场话剧——没有一个具有电影感的剧情连贯性。,推荐
Aaroncae,不可思议，不可思议的中国！过去如果就让它过去，未来只会越来越糟……荒诞的乡村魔幻现实主义，话剧化的影像呈现，意料之外的大胆暗指，幸好有个民国，不然连借古讽今都没有借力点。PS：“我”不能向“他们”下手便只能对自己开一枪[骷髅],推荐
女王,我讲个笑话，你可别哭。。。,力荐
低气压少女。,理想主义者最大的悲哀就是被现实的子弹划破皮肤时被迫选择是如铁男那样跪下还是如一曼那样把桀骜的自己杀死。毕竟现实中没有“延安”，从来没有。,力荐
ziv,越看越心塞，看似荒诞却每天都在上演,力荐
LSD,本子是好本子，演员是好演员，故事也是好故事。电影本身可能镜头欠缺，执行欠缺，但在国产片一滩烂泥的现在，我还是推荐去看。,推荐
小梁哥哥,任素汐不漂亮，但是她太美了！,力荐
炸鱼味,看到开心麻花就想打一星，任性,很差
巨颜童乳喵大梦,大陆现在能看的电影都不能依靠“电影”演员了…开心麻花的新尝试，但总觉得有点用力过度，希望慢慢摸索的过程当中可以给大家带来更好的作品……用力过度的感觉就是最后揪心的一整段有种为了惨而惨的剧情安排，其实可以更自然一些，更搞笑一些，不然有一种前后脱节的感觉,推荐
竹蜻蜓,必须给良心好剧一个应得的分数，多去看驴得水这种好剧，少去看爵迹那种大烂片，消费者用脚投票，让烂片彻底滚出电影圈！！！！有笑点有泪点，很荒诞，很不可思议,力荐
山崎贤人老婆,略略略,很差
追＞＞←_←,一场热热闹闹的闹剧，整个片子充满了戏剧感，演员演技着实给力，从哈哈哈到悲情落幕，驴得水LDS领导说，好看。套用一句台词，过去如果就让它过去，那未来只会越来越糟。,力荐
陈娴,伪文青哦！你别装逼，装逼遭雷劈,力荐
zidane2311,非常喜欢话剧形式的电影 觉得就是看一出很便宜的话剧演出 也是可以的 。以前看过的《狗镇》《十二公民》都不错 。这部电影同样不错 寓意深厚 人性善恶。,力荐
