叁笙三世,挺沉重的电影,推荐
龙猫兄 你好,脸跟水洗似的结果眼线基本没晕 底妆也还在 腻害了我的哥,力荐
我不是我,没有我想象中好看.听说喜剧却很悲.感兴趣的去看了.但是总觉得突兀.悲剧的话.就痛快的撕裂成丑恶的结局也许更好点.个人觉得而已.然后.最后的字幕.把本来的突兀搞得更突兀了。,推荐
王铅,看前半部分让我有让子弹飞的惊喜，铜匠爆发让人有一种用力过猛的出戏，冲突异常强烈，效果过于明显。,推荐
always_sun,荒诞又写实,力荐
Mayrockid,黑色，幽默，荒诞，疯狂，讽刺，真棒。好喜欢，但总觉得不像在看电影，也许是因为舞台剧改编吧……话说前面那个带她女儿来看的妈妈一定后悔死了，各种荤……,推荐
voiwereni,有很多喜欢的地方：表演很出色，每个角色都很鲜明;有一些很出彩的喜剧包袱；冲突中挖掘了人性，等等。但是又有特别不喜欢的地方，显然他们越迈越深的过程中有很多动机不清，搞得到最后我也不知道该不该同情他们。如果把动机缺失归结于荒诞的话，形式上又有所欠缺。,还行
wuwking,红楼梦一样，一场闹剧后，有节操的女人承担所有人性的恶果，男人代替驴牲口一样的活下去，自己一点点在座位里下滑萎缩，如果自己身处剧中也是众多男人居其一，甚至生活中都或多或少扮演过。任素汐的《我要你》真是触动心弦，如果她在上海真是没周璇什么事了。,力荐
北上列车,……剧本相当惊艳，但是看得不舒服,推荐
麻卖批耶,过去的如果就这么过去了，将来的只能越来越糟。好的地方就不说了，槽点如下。前半段过于恶俗和停留在春晚水平的段子为了刻意表现一曼放荡不羁的性格，前几分钟女一一脸控制不住自己笑场的即视感矛盾冲突来的太密集太戏剧化说点没看懂的同仁大学何解是从左向右的写法结尾的彩蛋也还不错,推荐
狒狒不洗脸,两年前看过话剧，终于搬上了大荧幕，虽略有删减，但表演的力度和投入依旧。得水，很高兴再遇见。,力荐
哈比猫.,说是喜剧 后半部分却觉得好惨,还行
眯不下,没有批的那么差，也没夸的那么好。看完心里也没难受，也没被触动。,推荐
黄花菜哪有春天,2016.11.3.故事非常好，但是戏剧冲突过于突兀，看起来不像是一部电影，感觉剧本还可以再细化处理一下。,推荐
江油乱舞,一曼，明媚到女子看到她都会爱上她的人。,力荐
乌合之众之王,满脑子都只有女主。,推荐
请叫我土豆君,超赞！,力荐
从我眼前消失,一曼前半段的笑真的不是笑场么我总觉得笑得好奇怪。。,推荐
安餮,比夏洛特烦恼的三观强了不是一点两点。但整部片子看着就像是录像版的话剧，总觉得哪里怪怪的。,还行
特立独行的猫,除了剧本和女主 其他都很糟糕 导演根本没有任何镜头语言 所以我是在看话剧？演员的声音太吵 过度了,较差
落尽,笑着叹气。,推荐
十方世界,豆瓣是应该设置打分的门槛 否则乱打分和不分级终会造成一场电影灾难,较差
little l,为了金钱，利益，欲望，强权，攀比人们纷纷低下了头。张一曼最可悲的吧。这群知识分子不过都是一群小丑……,推荐
黑炭,哎呀呀,推荐
张小排,早上心情鬱悶，帶著去看喜劇的心態去看這部片，看完壓抑到發現一天都被它毀了。。,推荐
双鱼理,我想，你是温柔又自由的风。 to 张一曼,力荐
老马-mmx,纯从观影角度看也就3星到4星，毕竟不是纯粹为了观赏性拍的。可能功夫没到，众多大神的隐喻，讽刺没太感动。可能为了过审查，太隐喻了，没有让子弹飞那种爽快,推荐
途中~,被同学骗着是喜剧去看的，结果看完心里好堵,力荐
夏娃的苹果,看完还挺难受的，sigh,力荐
_`tan,套用民国的壳子讲些敏感的事情。手法并不高明，但是拍出了还算是高级的喜剧。片里最讽刺的不是欺上瞒下的官员，而是最底层的人民体会了更高层级的生活，妄想打入上流社会。是弱小的人民手握权力的时候，是去蹂躏更弱小的人。佳佳是明大义的，不过最讨人喜欢的还是一曼老师，一如你高开到大腿根的旗袍。,力荐
wangzunhao1234,人性如此 没有看到影片的闪光点,还行
弓月,"1最后孙佳投奔延安的字幕，毁了意境2魁山和铁男性情大变的转变有些过快，但一想也是合理的，更暗黑寓言3有推崇美帝的意味4大家一同去支教，造假驴得水时学历怎么会高出大家那么多呢，教育部都关注他5瞬息间则又乐极悲生，人非物换，究竟是到头一梦，万境归空6已经蛮好了，锱铢必较不好",力荐
鷓鴣天,incredible China,力荐
A,看完心情好沉重。,力荐
别拽我尾巴毛,不值得这么高的分,力荐
小红丶gg,令人惊奇！唯一缺陷就是电影感差，舞台剧风格浓重,力荐
足迹,充满讽刺和荒诞的悲剧,推荐
美涤,有点太刻意了,力荐
稷下湖水怪,荒诞黑色喜剧，据说原版话剧内涵点更多，有机会瞅瞅,推荐
吴端,除了受不了太过压抑的不停磕头和“我错了我错了我错了我错了我错了”，还有太舞台化的表演外，完美。,推荐
inbradible,怎么说，不像一部好电影。,还行
硬是恼火地很,incredible china,力荐
.O0草莓,悲剧。看得我压抑的。除了黑镜子。第二个能让我感到压抑的片子,推荐
成双,一个认识的演员都没有，却胜过大牌云集，真是个好故事，很多细节都打磨的恰到好处…国产又一神作，我给满分,力荐
大婊贝,可以，很丰富。其实吧...你说它到底红不红呢？,推荐
缓刑,太喜欢一曼这个角色,推荐
最爱司马,剧本太nb，女主戏多了点，太温柔了，话剧应该更好点。,力荐
销魂不过夏洛,今天才武汉看了话剧，终于知道什么叫做讽刺和高级黑  一个很高级的故事,力荐
一一,黑色寓言。还有啊，讨论一曼是不是真的放荡是不是默认了“放荡”的女人就能随便搞了？讨论个几把。,推荐
killer,歌儿真好听。女主演自作自受 但是顾全大局,力荐
恣纵。,喜剧看哭。最喜欢的台词：过去的就这么过去，以后会更难过。,力荐
鲨鲨比亚丶,黑色喜剧让原本就不好的心情，更尼玛不好了。,推荐
正正,周铁男向特派员下跪 不是忍辱负重 不是卧薪尝胆 是真的怕了,力荐
蒋小川,为一个女人哭的泪流满面,推荐
阿宝,过去真的就过去了，未来只会越来越糟,力荐
骑士精神,我觉得挺好看的 够讽刺的 很多人性的观点,推荐
重光,话剧腔太重,还行
柳韫殷,就是一出悲剧。没有答案。想了一堆，都经不起推敲。菩萨畏因，凡人畏果。电影正上映，先给5星支持下口碑。觉得这电影太短了，转变就突兀起来，如果有时间累积，后面实在是不需要爆发的。,力荐
多拉拉A梦,讽刺，隐喻，放大的人性的污点:怀抱理想的人处处委曲求全，宣扬正义的人学会阿谀奉承，老实忠厚的人变得暴戾恣睢，处心积虑的人更是唯利是图，最后追求自由的人死了，最后内心纯粹的人走了。唯有一句:“过去的如果就这么过去了，一切只会越来越糟!”。,力荐
二向箔,作为喜剧而言，太厚重了。,力荐
草心睿,赞一曼，非绝色佳丽，却气场美！,推荐
交并补,好奇一曼有怎样的人物小传，是要经历过哪些才会这么聪明性感而温柔啊。,力荐
敢偷我萝卜,我不知道国内的观众会怎样对待这部让人不怎么能发笑的喜剧，里面的《我要你》真真的好听,推荐
Celia,这个都不像是个电影……太戏剧化了，各方面来看……,还行
孤鸿野狗,人，总是经不起考验的。有特点也有缺憾的好电影，故事有点经典，有点简单。有个槽点忍不住：时间设定又不是二十一世纪，哪来开衩那么高又没有衬裙的旗袍。,推荐
春很二,看完以后只觉得活着好累啊。,力荐
Hinata,一部好片，全程很投入地看，喜欢女主的歌。除了孙佳，其他演员颜值不高但是演技在线，看到了中国电影的希望。,力荐
三叶君,我喜欢,力荐
claire,一步错，步步错。当所有人都深陷这个巨大的谎言时，只有一曼只是单纯的向往那种自由的生活。,推荐
嗷嗷嗷嗷兔,如果结尾学校没保住，会更好，思想深度有了，笑中带泪，有机会去看同名话剧,力荐
_ShiR,歌儿不错,推荐
爱吃酸菜鱼,其实是一部不错的电影，可以给四星，可是我并不推荐，里面关于人性的描写太肮脏，戏剧效果的矛盾冲突转折等等都太刻意了，很不自然。看的时候很不舒服，想骂人，想让那一个个的都狗带，最后他们居然都挺好，只有我这个戏外人气的慌。唉,还行
打瞌睡的土狗,电影是扇门，通过各种拍摄手法来传达制片人们渴望表达的东西，观众看到这扇门，从而思考，自己打开门，去接近制片人们渴望传达的内容。可现在很多电影只是墙上画着的假门。,推荐
Serafim,有哭三次，都是为了一曼,推荐
绿苑,借古讽今。女主演的演技印象深刻，令人眼前一亮。转变前后的众生相，充满黑色幽默。,力荐
Lithium,电影or话剧，还是更在意故事。,力荐
Liet,整体的表达方式会让人觉得非常奇怪,还行
爱宅爱蹦跶,任性五星。不了解评论里说的电影质感是什么，也不关心。电影比话剧的受众多太多，好的故事，好的思想通过受众更广泛的媒介传达出来再好不过。,力荐
索子,白云万达2点映,力荐
鼻涕犀牛,剧情不错，但要是个话剧 效果估计更好,推荐
前尘迷醉,久旱逢甘霖，难得佳片！剧本扎实，演技到位！,力荐
崔荣水,可以用高标准来要求 并且还能超出一点预期的片子 每个人物性格是有了但是还不太圆,力荐
Charles,看完很堵，一个错误要后面更多的错误来弥补，结果越来越错，要承担的后果越来越严重。剧中的女性都是悲剧化的后果，只不过一个去了延安，生命暂时无忧，亲人分离；另一个则是疯癫后自杀。男人们的丑态毕露，撕下表面的强大与喧嚣后懦弱无匹。,推荐
LIP阿姨,在影院看过的最好的电影之一，很少看到演技、剧情、笑点都在线的国产电影，段子包裹下的是个悲惨的故事（我能说我差点哭出嘛），只是作为悲剧少了点衔接剧情，作为喜剧少了点笑点，不过何必那么在意定位？摄影配乐剪辑流畅性都佳，“讲个笑话，你可别哭”，五星！,力荐
C_C,电影院有人笑出来。。我就蜜汁尴尬。。。,还行
一介青矜,其实大家都提到了，话剧导演对电影镜头运用青涩粗糙、叙事零碎、取景简单，但依旧不能掩盖掉优秀的剧本、认真的表演。以台词上的抖包袱来正儿八经的讲故事，优秀的喜剧内核果然还是悲剧，全程我都笑不出来，但观影体验还是很好的，好在深刻于看见他们为了理想而一步步妥协直至撕碎每个人最美好的事物。,推荐
北岸说不,电影版总体不如话剧版，很多冲突还是通过话剧形式表现的更为生动,推荐
相禾,喜剧外衣下的悲剧故事，没有完美的人。,力荐
李畫畫,主题曲太好听。,力荐
爱吃醋的山西人,作为一个教师看了之后觉得满满地讽刺，演员都很不错。,推荐
我的快乐时代,电影版太好看了！竟然能过审，简直不可思议，incredible China 。披着喜剧外衣，故作轻松地讲了一出悲剧，让人欲笑却泪。下次舞台剧来巡演一定去看。,力荐
Ciby,四星半 话剧气息太浓重了 技巧可能并不是一个好电影该有的样子 但是剧本无敌 佛,力荐
记忆深处的飞_Fa,换成共产党，就是五星了。哎,推荐
丹,看的心里难受，荒诞的黑色幽默，周铁男不管多么硬气，面对生死也是真的害怕了吧，畏畏缩缩……一曼唱的那首歌真好听，原来蒜皮也可以是雪花的，真是个浪漫的人儿……,力荐
vagabond,如果事情就让它过去，只会变得更糟。当看到这句话时，我想到了我那个只会逃避的父亲。事情不会过去，不去解决，只会更糟！,推荐
仙梦白,感觉风格很姜文，看的时候脑子里全都是《太阳照常升起》和《让子弹飞》。故事和演员好评！,推荐
uncle-marc,和lina.在昊元看的。我觉得是一部对中国人尤其是中国教育的讽刺剧。一曼就是一个牺牲品，其实剧中所有的人都是典型的逻辑错误型中国人。为了一个错误去犯下更大的错误。最后那一声枪响有些悬念，一曼是真的疯了么？那他又如何完成那一套她幻想中的校服？,力荐
杨小林恩,开心麻花真是国产片的一股清流，新片『驴得水』真心好看，尤其喜欢张一曼这个角色[爱心][爱心][爱心],力荐
兜兜轉轉,到后来有种被人强摁着承认我深不深刻高不高级的感觉其实挺没劲的。,还行
饭里,黑色幽默也不是这么个幽默法的好吗？真的烂到想愤然离席。,很差
肉脸花花,Not bad but too dramatic.,推荐
2妹不是真的妹,话剧意味十足的一部电影 前半段靠荤段子撑起全场 后半段节奏很快 代入感十足 国产十佳之一,推荐
二蛋,所以说如果是男神女神就不能和屌丝约炮 btw这东北口音,推荐
我来打老虎,惊讶于广电的审批尺度，故事很好，可画面的局限性太小，主创并没有从话剧的思维里向电影跳跃,推荐
沫酒酒,这样的喜剧发人深省，剧中的对比让人笑的同时心里沉甸甸的。,力荐
Melody,在这个光怪陆离的社会中保持一颗本真的心好难。有一天，当自己不认识自己，那是多么的可悲。,力荐
芽,人不能没有希望，不能心死。,力荐
活着真好269,剧情无厘头，反讽意味极强，能通过审核公映，有点意外，跟现代社会上的许多现象可以对得上，演的有点夸张，但是这样一部辛辣的电影值得好评,力荐
一只小花伞。,还挺深刻的 讽刺也到位 有时人生就是这么无能为力 哎 就是有的地方用力过猛,还行
Niko,一个谎言裹挟着所有人，坠入无底深渊。打碎一切脆弱外表，人性尽显。,力荐
叶知秋。☂,不喜欢这种照搬舞台剧的电影。不过看完以后，歌一直在脑海里单曲循环也是醉了~,力荐
椒盐蕉,用力过猛,较差
Black bird,过去的如果就让它过去了，未来只会越来越糟！佳佳才是这群人里最清醒的 该面对的错误一定要面对,力荐
Roxy,讨喜又不太浅薄,推荐
Kurtis,剧本完成度来说，科班本科毕业的水平吧，表演一漫可以，别的没什么亮点。当看到一半了解了主题以后，再看到在反复强调这些东西，就很厌烦了，太说教了，就像有人在公众场合大吼大叫一样。结尾的字幕也是挺广电总局的。,还行
思无邪,居然还有的映。舞台感十足，以致场景逼仄、表演几乎全靠台词和吼的问题也一并同步了过来。这种内容，这种戏剧性，还是做成话剧更好。喜欢最后弹球散满山坡的处理，一声唏嘘。,推荐
花椒,对人性和社会讽刺，借古讽今的把现实社会各个阶层本质表现的淋漓尽致。每个人性丑恶嘴脸也在矛盾中慢慢激化。看到铁男跪在地上不停磕头的时候我觉得他已经死了，校长看似是全片中道德高点的人其实也是一个功利主义者，裴魁山铜匠虽然不一个阶层但本质都是一样的男人，一曼才是一个真正渴望真爱的好姑娘,推荐
Ray,年度十佳！,力荐
Vampire,想看舞台版......,力荐
巴扎嘿,想给全世界安利驴得水！！！太好看了太值票价了，啊啊啊啊啊啊啊，这个月倾家荡产也要去看话剧！！！一曼被骂时，我猝不及防就流泪了。因为……若处在相同境地，我不知道自己会是那个被骂的还是骂人的，呵呵。,力荐
moint,没有想象的致郁,推荐
曾几荷时,喜欢张一曼与男权社会格格不入的荡妇哲学 浪漫玩过火就是谋杀 人与牲口一线之隔 爱与恨一念之间 最后那声枪响意味深长 好片,力荐
琥 珀 主,作为话剧5星，作为电影勉强3星。电影感欠佳是一个方面，最早看话剧剧本的时候，就觉得一曼这个角色写得也太简单粗暴了，使用性太强，一言一行皆在让观众发笑或是落泪，转折跟逻辑都不够通顺。电影则更放大了这种不适感。但女演员确实挺棒的。,还行
雅加达一条鱼,剧本炸裂！但是孙佳投靠延安的结局挺黑色幽默的。,推荐
铸剑人,当年在木马剧场演第一轮的时候就看了舞台版，挺喜欢的，踏踏实实写剧本才是好样的，加油。,推荐
shooter,无论是隐喻 还是明说，都很深刻，是可以和《鬼子来了》相媲美的伟大作品。最后出现一句孙佳去延安，就理解成一种刻意的讽刺好了，大家都懂得,力荐
Tree,原谅我先看了豆瓣评论期待太高，感觉为了讽刺而讽刺，而这种话剧式的用力过猛在电影院看真的有点违和，特别是人少的电影院。唯一有感触的是一曼穿旗袍唱歌的时候真好看,较差
起名技能点已失,悲伤吗,力荐
阿米,开始还以为在看一出low爆了的性喜剧，没想到却是一出荒诞讽刺的黑色幽默。话剧仪式感很重，剧本很扎实。可怜一曼和得水。,推荐
Shee,喜剧的内核是悲剧。不过，换我做编剧的话，我可能不会让一曼死，原本活得那样肆意的人不该那么容易就疯就死，她的心理应该是比较强大的。照我看，结局应该做成要么只让佳佳死，要么只让佳佳活。,推荐
唯能vernal,打算多看几遍，看着太过瘾了，虽然还是有点话剧的感觉，但也能甩投资巨大的大部分国产片几条街。国产片的榜样。,力荐
ppv龙,是谁没有受过教育，又是谁该被教育,力荐
胖子坚持减肥,快节奏的喜和悲，或许是看的少，很喜欢这种话剧风格，很有意思,力荐
一弯岁月,近几年少有的经典电影了，片中对人性的刻画真的深入人心啊，除了校长女儿就没有一个好人，每个人都为了自己的利益做着龌蹉肮脏的勾当。极具讽刺性黑色幽默，把为人师表的老师和教育局的官员讽刺的一文不值啊。现在的教师又有谁能做到“蜡炬成灰泪始干呢”。也不知道这么敏感的电影，电影总局怎么通过的,力荐
sin2cos2,16年最难过的电影，没有之一！太讽刺了。,推荐
Lee,虽然很像话剧，但这有什么关系呢，太喜欢一曼了,推荐
鐘無念,难道没有人觉得铜匠很像刚出道的林俊杰吗,力荐
叶叶叶叶叶叶叶,唉 挺可悲的 也很难过 心疼死一曼了 任素汐好棒 有没有一曼传可以看,推荐
岩井,当你说了一个谎言，你就不断需要用更多的谎言来圆它，纸包不住火，最后圆不住谎，讲以悲剧收尾。,推荐
float,也许有的人成为英雄只是因为打中了第一枪,力荐
steven,电影非常好看，针对人性的弱点毫不手软的揭露，看似荒诞，实则针针见血。,力荐
一尾金色鱼,越看越压抑，不错,推荐
我还记得,这次很及时就看了，这个故事讽刺了丑陋的社会现象，不明白一曼是怎么样的一个女人，绝对不相信是一个荡妇，前面的剧情还挺逗的，笑点频繁，里面的那首歌也很好听。,力荐
淋雨心,幸好不是完全的黑暗，总是还有希望，总是还有往前走的人,力荐
大锅小蝈落地盘,好看。男人是驴女子为水，争夺利用抛弃牺牲。\\ “真理和谎言一起下河洗澡。谎言先洗好，上岸穿上真理的衣服走了。真理上岸时发现衣服不见了，又不肯穿谎言的衣服，只得东躲西藏。于是，我们看见谎言穿着真理的衣服到处招摇撞骗，大家都把谎言当作真理。真理反而躲躲藏藏，羞于见人。”,推荐
Deb,谁他妈告诉我这是喜剧的,推荐
没没,原来不是我一个人对电影的话剧感感到不适啊,还行
淘汰之刃,也就剧本还行。,还行
MG_and_Ll,剧情表演用力稍过了一丁点，但瑕不掩瑜。用喜剧写悲剧，用讽刺写人性，从开始是点点笑声，接着哑然失笑，惊诧失措，到最后竟是深深的压抑，久久不能释怀。人，也许很容易就放出自己心中的恶魔,力荐
少了一点光,前面看的开心着呢，后面看得我心都碎了！难受到不会看第二遍的佳作！,力荐
Recho@lee,我不管它拍的有多讽刺，老子就是看得憋死！妈了个鸡的！,较差
Geneya,尽管高级黑 但小剧本还挺让人感动 怎么说呢 其中就是被女人蛊惑过的“纯洁”男人的复仇推动剧情 人物立绘还不错 但最纯粹的人还是佳佳 其他的人设都是趋于毁灭的变动罢了,推荐
抓死你,本年度最佳国产,力荐
橘子都凉了,难得的国产好片，中国电影的希望，真的，比起大导演大成本名演员的商业捞金烂片好太多太多了。这种片子才是中国电影的希望  有人觉得把话剧生搬上荧幕是圈钱，但是我想说话剧的门票从上千到几百是每个人都能随时去看的吗？就算是话剧生搬过来 只要是好片子 几十块钱太值了！人家几百上千看的话剧,力荐
Karoc,中国电影确实在成长,力荐
少爷,年度最佳。,力荐
木叔,好了，我反正是理解不了什麼叫“話劇能成電影還得了”這個觀點。,力荐
Di222y,用喜剧演绎悲剧,力荐
唐布,铜匠的转变，裴魁山的转变，张一曼的被削发与自杀，以及几乎每一场爆发式的争吵，没错，就说那小孩，太过了，处理得很舞台剧，这不好。,推荐
墨熙,电影中的话剧，已经很棒了,推荐
苏子芜,呃…感觉差那么一点儿…表现形式有点乱，虽然是荒诞喜剧但是人物转折也不好太生硬吧……而且好多情节都觉得演员表演有点用力过猛。剧本还是有点儿意思的～,还行
御风而行_,内容表达得很多 主线清楚 人物塑造饱满 从三个阶层去表达人性和教育 ，强权、知识分子、普通农民。一个人如果只受到知识教育而没有品德教育那真是教育的极大失败。,力荐
lynn,45，够讽刺,推荐
王语心,任素汐，可以啊,力荐
怪物不得了了,nice!,力荐
TankMan小明装甲,好看，女主角印象深刻,力荐
FlyDonkey,故事很棒，但是除了女老师其他人演技扣一分。尤其是校长,力荐
听说你找我？,话剧感很强，人物性格鲜明，歌很好听，但实在太惨了,力荐
蒙蒙夫,这是打了韩式鸡血的恐怖片,还行
走碎步的小短腿,太沉重…扣一星…,推荐
皮皮鲁耍赖皮,周铁男下跪那一刻看哭了，人在死亡面前什么都不是,力荐
Nalak,任素汐太厉害了！其实不如就按狗镇拍一个舞台剧。,推荐
哆啦烘焙,任素汐的歌太美了！,推荐
小柏smiling,一曼不是你想睡想睡就能睡,推荐
DaZuoo,年度最佳,力荐
王正义,演员演得很好，喜剧效果也足，剧情也有吸引力，至于一片骂声的刻意、不合理、生硬、舞台感太重，我个人觉得没那么严重，角色转变也都有据可循，好看就是好看，就算是惹人生气震怒，那也是好看。★★★★,推荐
狂雨,话剧风格，每个角色都有可爱与可恨之处，剥蒜张一曼太撩人~,推荐
小冰一直在路上,真的是太有舞台剧色彩了，只不过那么多小黄段子它是怎么过审的。不过当看到出品人里有Peter还是自豪了一下,还行
Cvani_,计划之外的观影，却给了我相当大的惊喜。事实证明，一部电影的好坏并不需要那些流量明星来撑场面，剧本和演技还是最重要的。剧中的笑点很多都在打擦边球，尺度之大是我没有想到的。故事很棒，代入的思考也很多，唯一遗憾，结尾部分似乎有些简单草率。,推荐
耳土八久,像看过的几出话剧，矛盾冲突很深，但制造这些的过程会显刻意，并且往里面塞了很多东西，影片也想讲很多道理，还好都讲出来了。第一次在大银幕上看关于女权的国内电影。,还行
不改名字了真的,特色的....,力荐
miokj,能哭能笑,力荐
泽布隆,在这个国度，所有悲剧电影都值得歌颂。,力荐
王大发,观后感1、好电影2、浑身难受3、恶心……,推荐
南雨一,荒诞喜剧，魔幻现实。哎，不敢相信是去年夏洛特烦恼的团队，厉害了。,推荐
LugTon,中国需要这种电影,力荐
Wendy.Dai,话剧感太强 极力想要表现出冲突 但在舞台上是好的，可是换成电影就会觉得用力过猛。电影连贯性更强非要继续用这种歇斯底里的表演来展示 觉得有点没必要...,力荐
EvangelineTong,编剧给满分。终于看到一部，是完完全全佩服编剧功力的片子了。一个人的性格会在什么时候改变？这大概是最考验编剧的地方,力荐
