Mrs.,导演硬是拍成了平面话剧，但是还是好看！,力荐
Qing,剧本真的很赞，国产电影里罕见的真正可爱的女性的角色。原来以为是个喜剧去随便看看，结果几度暴哭。,推荐
阿法纳西耶夫,从电影角度来说，这不能称作一部电影。,很差
梅林,2016.10.29 津湾中影 VIP 21.8 22点45分,力荐
夕月木,没想到开心麻花是这样的开心麻花。刮目相看。后半段太具象，对观众冲击好大。,推荐
幸运的硫克,慕名而来，唏嘘而归。话剧的冲突点展现得淋漓尽致，笑得越开心就有多憋屈，看到最后觉得每个人的愿望确实都实现了，校服有了，学校有了，奖金有了，可是人却。。。,力荐
Sybil Glass,“过去的如果就让它过去了，未来只会越来越糟。”真是吐槽“国民性”和人性弱点的黑色讽刺剧，看完觉得好悲哀，这种反英雄主义、反浪漫主义的剧本太适合放在战争背景下了，理想就是这么一步步经历考验，最后崩溃的。这个片子影射的东西太多了，人性的恶最容易在“铜匠”这样的人身上得到体现。,力荐
Wawayi,看过不少荒诞的喜剧，但却很少看到荒诞的悲剧，上一秒还在乐，下一秒就抽你一嘴巴。到底电影有多好我说不准，但至少不应该错过。,推荐
拧巴小柒,遗憾木有先看话剧，这样我就可以不用看一部像话剧的电影啦～,还行
紫I'm male thx,没看过话剧，所以不对比。过程是一次次的哀叹与无奈，结局的设置令人警醒，虽然觉得以一曼的性格她应该能走出来，看淡一切，但那样的话故事可能也少了几分重量。任凭再坚韧的性格，人总有站在崩溃边缘摇摆的时刻。,力荐
再贱,意外好看，看之前内心还是拒绝的，以为又是普通夏洛特烦恼之类的影片，没想到后面真的就是笑着笑着就哭了,推荐
Sanjade,观影体验差，只有演技在线也不足以支撑大银幕的检验。,较差
欲火焚身大姨妈,和你看的第一部电影，很开心。,力荐
怪怪物,红果果的悲剧,力荐
姥爷叫我小老子,不是话剧胜似话剧，笑点不足虐心有余，影射社会展露人性，黑色幽默有待升华。,还行
小钢蛋,窑子里闹文化大革命鬼剃头，这狗血洒的，洋人大屌格外香。一星嫌多。,很差
Foreverseeking,开心麻花去年的夏洛特烦恼就很喜欢，今年第二部作品，带着乐观的心态去看，确实很不错。首先，剧本很扎实，话剧的基础确实让剧本稳扎稳打。其次，风格很独特，从头到尾能看出很强的话剧味，不过演得很好，形式方法都是其次。最后，作为一部喜剧，开始各种搞笑，后面各种荒诞，很黑色,力荐
soul man,人性的光辉它熠熠生辉，人性的光辉它黯淡无光,力荐
Qoo|夜深动物,感谢有这么个不在我党领导下的荒诞年代，才容得下多么荒诞的事,推荐
唐人街,给舞台剧,推荐
一个少女,黑色喜剧,推荐
流夕麟,拧巴翔,很差
棉棉,抱歉没有get到……,还行
null1pm,年度最佳 太多的借古讽今 太多的黑色幽默 难得在电影院见到的好片…,力荐
鱼鱼爱吃饭,一开始还在想这么讽刺的电影居然能过审，后来一看背景。。。好吧。。 故事是个好故事，但是整体来看有点怪怪的，喜欢里面那首歌！一曼这个角色演得真好。,还行
红糖豆包,不把观众当傻子的电影，今年真是少有，感谢驴得水尊重观众的智商！,力荐
逸子夫,比想象中的好太多啦，虽然浓浓的话剧感，但也保留了话剧比较大的尺度，黑色幽默借古讽今，又狠又准。我估计广电能通过不是因为尺度超大，而是心安理得地告诉自己这TM是说老蒋呢，尤其最后投奔延安更是戳中了广电的g点。总体而言非常推荐，毕竟当下电影难得有直面社会的了。,推荐
Wings공주,我就觉得很正常而已,力荐
vivian_li,很欢乐呢,推荐
方小boss,荒诞的故事，真实的人性。,力荐
佐兔子,和让子弹飞一样时代气息浅所以显得有点魔幻现实,推荐
筱田狸,笑中带泪，很有深度的喜剧片啊,力荐
山崎贤人女票❤️,借古讽今，话剧感太重没有电影语言,还行
默默的山,整部剧哭笑不得，既愤怒，又无奈。最后的一声枪响，好像一个响亮的耳光，打在我自己的脸上。,力荐
涼風,这不还是舞台剧吗,还行
可琦,比魔幻更现实，比现实更魔幻。,力荐
西里,想去看笑话的，就别去了。,推荐
Hana_azura,论知识分子的纯真是如何丧失的,力荐
Rumpleteazer,写这剧本的心理变态吧,很差
橙色的萝卜,看完红太阳是怎样的升起的  再看这个 哎,推荐
夏昊BFA,WLY @UME,力荐
言午许,不错的电影，戏一般的人生，主题歌改得好,力荐
赵小跑.,很棒！,力荐
乐义,都说太话剧，好电影翻拍话剧没啥问题，茶馆不一样也是话剧。今年考的过得眼有伤感的片子。女主歌唱的洗脑了，怎么看怎么像何子旋。不过还是很美。,推荐
图拉图拉随夫姓,这不是喜剧片，是悲剧,还行
VeraWong,作为舞台剧，简直完美。作为电影，少了一点细腻。台词很精彩，镜头和场景差了一点。,推荐
爲什麽.exe,一曼下跪我哭了 从开头专款专项 我不知道为什么有人笑得出来,推荐
JIAOXINYUUU,泪目 一曼的随性我喜欢,力荐
北北,人物性格的生硬过渡，直白粗暴地堆到观众脸上来的中心思想，混沌不清晰的主线。但的确有处理得很艺术很美的时刻，有讽刺，有荒诞，就是差一口气，就是让人不停地自我间离，沉不到片子里。,还行
卜,打一巴掌给块糖，细尝之后糖也是苦的。,力荐
另一个自己,冲着喜剧去看是我的错，大中午跑去看，心凉的跟什么似的。怎么会这样，为什么要这样？任素汐的声音好好听。,力荐
wangzhy,别说我刻薄，我已经给了鼓励的一星……,还行
water.shining,黑色幽默，批判和讽刺很足，但是娱乐性差了点，不想去电影院看,还行
jimmy,一场小成本的舞台剧。各种解读均可成立却没甚必要。“如果过去就让它过去，以后只会越来越糟。”“你凭什么以你的道德标准来绑架我的利益。”,还行
我是十五,挺喜欢这种风格的，,还行
KB,过于夸张了，好在结尾天降神兵,还行
四级234,浪费时间，失望,很差
杀猪刀,张一曼是我今年第二爱的女主角,推荐
edith,所有的喜剧都有着悲剧的内核。我知道这部电影很棒，但就是喜欢不来。,推荐
袁晓婕,如鲠在喉。,力荐
似是故人来,当喜剧看还是不错的,推荐
小时候可牛B了,整片充斥黑色幽默，就是表演太过刻意，剧情太过狗血，经不起推敲，结局太荒诞，起不到警醒效果,很差
小蝎,在看的时候，我就想，这部电影我要打五星！最好的喜剧往往是悲剧。,力荐
华丽的佰哥,不好意思，话剧就在剧场演不好吗？为什么要拍成电影？,较差
阿笨,感觉一般,较差
提剑江湖,内涵有 讽刺有 隐喻有 夸张有 荒诞有 做作有 就是一台搬上银幕的舞台剧 戏剧冲突弱 影像剪辑弱 说白了 电影与舞台表现还是有很大区别的 另外 这片的水军超标,较差
聒噪,二刷，依然是非常优秀的电影，但在了解剧情的基础上，这一次没有被电影震住，优缺点都非常明显的作品，好但不足以被捧上神坛，在今年国产电影的大环境里是拔尖的佳作，诚意推荐！,推荐
Bailey,生活在三线，没看过话剧，但是电影要表现的东西却屡见不鲜，也许我们的院线太缺乏这样的影片 值得五星推荐,力荐
八门,剧本工整人物用力可是总让人有一种说不出来的不舒服。有惊艳但缺乏引力。,还行
超级玛丽·苏,进影院之前，请一定记住：这不是我们认为的那种喜剧，根本不是。,推荐
选择困难症晚期,用喜剧的方式讲悲剧，用讽刺的手法说人性，出色的剧本，精彩的表演，9分好评！国产电影接近裸体，《驴得水》是及时出现的一条裤衩。任素汐，实力派女神，你不用“睡服”我，我已经对你路转粉。歌真好听。美国人觉得中国不可思议，在中国人看来这就是真实的中国。花电影钱看精彩话剧，你们还想咋滴,力荐
阿涉,人类的尊严和智商并非不能两全呃,力荐
纯肉锅贴,不像电影,较差
Lanny,前半程略拖，后半程紧凑,推荐
乐未央,荒诞到流泪的喜剧,推荐
忍不住地想你,哦，天呐,还行
雅帕菲卡,我很欣赏剧本创作者的勇气和想法。但是很遗憾，这基本不能称得上是一部电影，没有过渡 没有情感梳理  没有铺垫  话剧式夸张的表演和转场被银幕无限放大 造成不适的观影体验，应该会再去看看话剧版。,较差
pulp croc,人之恶,还行
期期期,电影大半部分是为了讽刺，或者本身就是为了讽刺，但囿于一些因素，黑色幽默并不彻底，且局限与其简单的因素。总的来说，国产电影敢于尝试这种幽默，值得一贺。,推荐
艾米的兔子,剧本其实狠不错，人物都诠释得很鲜活，但黑色幽默到最后太用力，有点看着难受,还行
瓦里安·乌瑞恩,看得难受，我也不希望去期待导演对人性考验的底线，看到一半出场了,推荐
linda-sun,精致的利己主义者——凭什么用你的道德标准绑架我的利益,推荐
静若处子人来疯,演的真好啊,力荐
张漠漠是女强人,今年看过的最好的电影。谁说国内没有好电影？一曼真是一个迷人的破鞋。铁匠还停留在最初的迷恋，那这段情窦初开真是迷人。电影院里都是在新西兰的华人，电影结束了，大家都舍不得走。,力荐
眼睛长在脑门上,太棒！锅匠的嘴脸简直太可恶，小人得志！,推荐
浮世心,我讲个笑话，你可别哭。好的喜剧都有一个悲剧的内核。无关表演，无关剧情，五星给麻花敢于触碰敏感题材的勇气和懂得自我保护的意识。麻花的作品题材越来越广泛，野心也越来越大了。,力荐
Se7en,很话剧   有细节   有思考,力荐
辞职就请你吃饭,情节荒诞，有点意思~讽刺的真是让人堵得慌,推荐
Esther,演员不错,还行
忧忘果与瓶子,4星全给剧本，虽然这是话剧剧本。故事生硬，人物性格转变得太粗暴了，导演分镜是用菊花画的吧？镜头太烂了……亮点是跳出了小资产阶级自怨自艾的看谁都不fen儿的套路，开始自我批判了，立意挺深,推荐
mijk,前门大观楼，一部一百多分钟的小品而已，不该归类为电影，剪辑粗糙，剧情过于舞台化,很差
烂片粉碎机,还是更适合在舞台剧中呈现，做电影的话，味道怪怪的，不过还是值得一看的，比粗制滥造的烂片强多了！,还行
而安,极少数心念想看的电影，对黑色幽默的好奇停不下来；全程大家哄笑的时候基本没笑，可能太过严肃了，许多事本就是细思难过的，比如送我上车的那一刻。,力荐
Ziggy Stardust,孙佳去了延安，注定要嫁给tg老头子，以革命的名义，然而出身成分的原因49以后的历次运动怕是一个都躲不过去。照现实发展下去才足够魔幻现实主义，黑色荒诞。,推荐
周争,镜头5星，故事和配乐4星，表演3星，导演2星。内地近年少见的非典型喜剧，难得一见的讽刺与幽默，值得更多中国电影人尝试。尚不到年度最佳。,推荐
幻影吸血鬼,虽然导演的水平很烂，但是依旧挡不住它是一部可以一看的电影,推荐
魂不守舍,绝对好看，剧情的黑色幽默中也有包袱和紧凑，我相信绝对中国民间中还会有这么多的高手。然后的确是人性，是能让人懂和看到现实的。虽然在电影院看着的时候，真的都还在记挂着工作的事情，糟心。2016.10.31,力荐
Starry N.,China is incredible！,推荐
白翅膀黑羽毛,不喜欢这种过于戏剧化舞台化的表演方式、也不喜欢角色的这种设定所传达的价值导向。,还行
朱安,跟什么样的人看电影 比看什么电影更重要,力荐
任孝恒ShawnRen,快下档去看了，搞话剧的能不能安安心心搞话剧。,较差
石小po,前半段非常好，后半段所谓荒诞越来越被剧情所累，仿佛为了黑色幽默而黑色，反而让人哑然怎么也笑不出来,还行
管制通胀帝,给一星因为你是开心麻花,很差
lavenderlei,千万不要试图挑战人性的底线。,力荐
夏茉,"三星半。电影有很明显的话剧痕迹, 但是还算值得一看。",推荐
若若朋友,每个人都不是好人，这才是社会写照。,力荐
漫舞,这是一部庆幸看过却不想再看第二遍、哭不出来又难受好几个小时的电影。,力荐
唐错刀,我来睡服他！前半段哈哈，后半段又难过了。讽刺收得相当粗暴，现实魔幻主义。PS：虽然电影成片甚有舞台风，但眼神肢体台词确实过硬，演员演技上线，片子成色就好啦。,推荐
李十三叫娄子,其实片子拍得还真不错 或是肯定剧本做得好 但让人唯一不爽的是片子让人看着难受 可能是舞台剧搬上银幕给人的说教感太强 而且越到后面越反映出每个人都不像好人都有劣根性 让人看着不舒服 小姑娘又过于正直 可能是极个别环节给人印象太深了 应该相应淡化一些,还行
Miss 1/3,配乐加分了不少，故事也比较完整。大家对国产电影要求太低了，如果不是因为国产反而不会那么多高分吧。后半段情绪急转直下，各种桥段开始生硬，这也说明前半段的精彩是靠小打小闹撑的。,还行
DanCowin,看过话剧，觉得自己眼光不错啊哈哈，当时就觉得会红,力荐
yuuko,免费场看的，真是个好电影，人性的善良、懦弱、血气，人生的悲欢离合百般滋味尽在嬉笑怒骂中。,力荐
菲到一亿光年外,好看，看完了之后不知道该心疼谁。剧情荒诞搞笑一路飙车，充满了反转，朴实的人变成坏人，天不怕地不怕的人也会跪下磕头，本来是为了留住学校“善意的谎言”没想到谎越来越大，作茧自缚。唯一没有改变的两个人一个死了一个走了。借古讽今，很有深意。过去的如果让它过去，未来之后越来越糟。,力荐
恩之,这个世界没有对错。这个世界一点都不美好。这个世界，真特么恶心。,力荐
悦，豆,感觉太悲剧太悲剧，反而有些过了~人物性格转化没那么自然~,推荐
柏云知秋,“有些过去的事情如果就让它那么过去了，将来只会更糟！”,推荐
saya1749,本年度最佳国产片！何必这么决绝的把人性抽丝剥茧的暴露出来。每个角色都如此生动，每个角色都像万象镜一样投射当今社会上形形色色的众生。让人笑中羞愧，自视清高的无地自容……却拿捏不出对错…打碎的面具三观混着原罪捏出的人形。哈！人真是怪物般的存在啊！,力荐
空山新雨,荒唐背后好心酸,推荐
胡晓晨,有笑有淚有思考，說教部分太扯淡，世界上不可能全是好人，別妄想著改變世界。角色過於鮮明，矛盾過於明顯，鏡頭過於呆板，明明白白告訴大眾這是一齣戲劇，不夠活潑。（BTW最後紅白校服孫校長一穿真像肯德基的老頭兒）,还行
不是假发是莉酱,四不像,还行
極風書生,我还是别评了，不知道怎么说,推荐
小雪,20161030我格广场,推荐
吴喋喋,和十二公民一样的问题，话剧搬上大银幕没有完成电影化的改造，但是不忍心给好故事打低分，就电影语言来说则非常贫瘠。,推荐
嘎啦,对知识分子的忍耐是有限的,力荐
浅灰色橡皮,任小姐棒，众人也血肉丰满地棒起来。镜头、时间、地域的拉长放大，都不妨碍你们把这银幕分分钟饱满热烈地填出一个新的好故事。,力荐
依稀枫游弋,中间有一段出去接电话没看到 伤心  要补！,推荐
奥维斯拉夫,年度佳片,力荐
MANGALIFE,开心麻花作品超期待！！结果…搞笑的开头伤心的中段混沌的结局让我非常消化不良…每一角色的心情描述的那么深，结局就那么的艺术？完全看不懂。为什么不搞一个喜剧的结局活着美好的结局呢？是不是小小团结接触了巨大力量就无法抵抗呢？★★★,还行
輕歌曼舞.,对于对着电脑翻译了一下午agenda以及做了一整天手术的俩人而言，剧情跌宕起伏无厘头得简直让人抓狂，俨然在看戏剧一般。或许是部有内涵的好片，但sorry的是，we are too busy for that 。,较差
陈不睡,想看话剧没看成 感觉在电影院看了个话剧 剧本很不错,推荐
土国全安,近些年看过的中国大陆最好的悲喜剧，叹服，叹服。,推荐
停云,很不错，更偏向话剧一点，更整个电影重心更着重于人物的表演和对白，但是也正是这种特性才能更让人通过电影反思如今，想想现实社会中很多人和事跟片中的何其相似！讽刺意味十五足,推荐
伊莎贝拉,人总有梦想，总以为自己很强大，所以会勇敢，会坚强，会奋不顾身的向前冲；可是人也总有弱点，总是自私，所以会崩溃，会妥协，会软弱，会贪婪；我不讨厌铜匠，不讨厌裴，不讨厌铁男，甚至不讨厌特派员，可是我永远都无法原谅校长，那个最慈眉善目，最无私公允，最充满理想抱负的人，其实最是恶心。。,还行
cjay橙小坏没有,这部电影，让你笑着笑着就沉默了。,力荐
瑪達,感觉老裴的批斗大会和周铁男后半段红卫兵的嘴脸只是导演对历史的戏谑一瞥，生活永远比戏剧精彩，想到这里都不寒而栗，想让人拍手叫好。,推荐
lemonscent,人都是被逼出来的,力荐
嘟哔嘟哔,前半段很欢乐，联想到《无声婚礼》，果不其然，后半段急转直下。每个人物都对应一类人：校长—为了理想不断降低底线；魁山—直男癌；铁男—嘴上有多硬，行动就有多怂；铜匠—欲望的反弹形成恶念；孙佳—稚气未脱的正义青年；一曼—女权代表。超前的性观念让她和时代格格不入，出事时第一时间沦为牺牲品,力荐
固力果爱大侦探小卡莱,现实中一曼这样可爱的女子才不会疯呢！另外看片感受最深的是，与没受过教育的人真的是无法沟通无法协作的…,推荐
Rainy W,台词感觉还是有些不够用力 演的又有点太用力  但是整体已经很很很好了,推荐
danieliudd,今年国产电影最佳。我们终将变成自己讨厌的人，在这之前，只是诱惑和威慑不够。,力荐
smiling,非常不适合大荧幕的剧本或者改编。所有的戏剧冲突和起承转合都来的太突然太生硬……好多台词在话剧舞台可能会有些逗趣或者震慑的作用，但在电影里却显得很低级……到后面为了硬要拔高和深刻主题而营造的悲剧也让人觉得不适……总之好多在话剧上可以忽略的问题在大荧幕上都变得非常别扭而不合理。,较差
绿子,我为中国能拍出并且上映这样的电影骄傲，但是，如果可以选择，宁愿看不到这部电影。,力荐
兔子不吃大蒜,前半段笑的挺开心的。后半段乐不出来了。说不出的悲哀和绝望。欲望让每个人面目全非。玩得一手好黑色幽默。666666,力荐
宇宙小毛球,特么的，我哭了。,力荐
Graine+,观众笑点惊悚,推荐
爱的曝光,如果你不知道是舞台剧改编，可能不会说是舞台搬演，可能转而会说是像狗镇一样的单一场景经典,推荐
Mars,从剧情到表演到拍摄，无可挑剔，但其灰色的价值观与人性的丑恶，实在是不喜欢。驴棚着火的隐喻实在有趣，校长、众人和孙佳的性格可见一斑，其他伏笔也很精妙。一曼阳光却不得善终，但她的性解放和“善意”却不必要的伤人却逼得善良单纯的铜匠兽性反噬，不必力捧。还希望我们有更多一样好但阳光的电影。,推荐
F,画至半程，果断打开了大麦…… 一个话剧感的电影，不尴尬。,力荐
破罐子,难受,还行
从心,太戏剧化了！教育不只是学知识，关键是学会做人。否则，知识再多，人再聪明，也只是个人渣！,推荐
圆形斑秃,一个彻头彻尾的悲剧。所有的美好都被毁灭了。我不知道一曼是女权主义的先导者还是性欲的奴隶，但我知道她比我们都自由果敢，比我们更快乐。,力荐
Whisper,整部影片中出现的两次枪响，与情景贴合不上，显得非常突兀，像是看话剧时听到的那种“音效”。心想这音效设计也太不仔细，出了影院再想起这件事，突然明白，原来这枪声除了响在电影里，也是响在观众耳边。,力荐
牛奶也是好的,借用一个影评：电影值得看，但看一次就够。看完后会让人觉得特别不痛快，特别憋屈想骂人，因为对于人性由白转黑的过程无法自圆其说，看完自然就会焦虑。甚至会联想到现实社会，为了适应改变而磨去棱角，或是变成自己曾经讨厌的那一类人，这种转变究竟是怎样完成的？好像很难找到确切答案⋯⋯,推荐
ikrf,161028 比话剧更有真实感，近几年最好最黑暗最真切的国产故事,力荐
归0者,开心麻花电影里人性总是如此丑恶，校长是那个年代一大批文人的代表，铜匠的境遇滋生了原始的恶，本来很喜欢热血老师，可惜也是个贪生怕死的主，女儿简直是一股清流，演员也赞，可惜个子矮年纪也不小怕出不来了，女一的演技就没吹的那么好了。没什么笑点，也没个电影的样子，也就剪头发那里的镜头还行。,还行
蜕变のLynn,其实想看个喜剧的，前面笑着笑着，看着看着却笑不出来了,推荐
樟妹.,除了话剧痕迹太重，演的太用力，中间有一段略尴尬之外，确实挺好，尤其剧本。一曼这个角色很好，歌唱的更好。7.8,推荐
柒声。,很久没有出现过这样的国产电影，光是因为这出现就都足够高分。在这风凉话的评论更像话剧、导演拍摄、演员台词低俗，难道在都已经2016年的现在，还不够作为人民的觉醒么？看不到那一个个痛点么？还在“过去的就让它过去吧”于是才能嚼着爆米花轻蔑讥诮地看着这个电影么？,力荐
William,"讲的前朝的事,打的今朝的脸,就是结尾略显仓促,可惜了",推荐
印度河童,生搬话剧电影感太少了！电影最大的讽刺在结尾的时候，可能是为了过审，小女孩去了延安,力荐
小巫,主题歌在脑海里单曲循环，想想这么一个温暖不羁的女孩子也会疯掉，每根稻草都胜过定海神针吧。,力荐
白菜帮,太吵,还行
猫毛|,用力过猛 好恐怖,还行
蒸蒸蒸蒸,看完终于知道为什么这么多人说这部片子恶心了，特别是后半段，确实。非常。极其。恶心。片子也反应了一个某种意义比较普遍的现象：约炮女生走心，求爱不成也总是一炮再炮，依依不舍。男神约炮走心，求爱不成花式侮辱女生，开启荡妇羞辱。片子里出现的所有男的可以说都是垃圾。,较差
八宝镇魂包子,看完电影对朋友说了一句话，用一句话就可以当作大部分电影的影评，导演或编剧想说的太多，但是都没说明白……,推荐
ddww911028,我觉得自己看到了身边每一个人。虽然都是名不见经传的普通演员，但表演都十分精彩。可以看到太多舞台表演的影子，某种形式上有点过头了。但其实也没什么不好。看的我很过瘾！,力荐
梵高先生.,女权主义，民粹主义，反政府，现实主义，大家各取所需。我只觉得脸上像被巴掌扇过，火辣辣的疼。,力荐
三木君,别人的笑点成了我的泪点。一群男人犯了全部原罪，导致一个女人的必然死亡。话剧没能顺溜地改成电影，转折急促，结构不清。镜头感弱，甚至出现景深和对焦问题。表演用力。喜欢剧作，有点女权的意思。剧本的解读空间多少弥补了电影语言的缺失。一曼清唱的《我要你》透着那么一股自由摇曳的野菊香味。,推荐
巴尔扎小人,尤其喜欢张一曼,力荐
头骨,故事还不错，虽然有些地方还是过于单纯。电影拍的不咋地，如果本子要完全照搬话剧，道格玛95类型的拍摄方法可能会更好。不过当然了，这样会损失大部分观众。不能说是一部很好的电影，但在国内电影当前的风气下可说是一部良心之作了。,还行
隐形人,看完压抑到不想说话。。。压了3公里马路才缓解。。。不够细想其实很多人物的性格不够健全甚至矛盾，感觉台词是为了接剧情拼凑出来的，而不像是同一个人能说出口的==而且有的情绪过于激动表演有点夸张。。。但是还是一部好剧,推荐
呼叫皮蛋,本来看见开心麻花就不想看了，夏洛特实在很恶心，看到好评才去看了驴得水，刚开始很好笑，后来很难过……难得有部情节极其紧凑的国产片，看到光头特派员和国旗特写的时候秒懂这片是怎么过审的了……,力荐
